{
  "schema": "piano.skill.structure/v1",
  "id": "legato-transition",
  "revision": "structure-v1",
  "name": "连奏与换指",
  "category": "articulation",
  "status": "planned",
  "purpose": "协调相邻音释放、换指与重叠时长。",
  "input_contract": "piano.practice_context/v1",
  "output_contract": "piano.practice_context/v1",
  "required_inputs": [
    "phrase_notes",
    "articulation_annotations"
  ],
  "effects": [
    "simulation.hand_proposal"
  ],
  "dependencies": [
    {
      "id": "key-contact",
      "revision": "structure-v1"
    },
    {
      "id": "stable-hold",
      "revision": "structure-v1"
    }
  ],
  "implementation_refs": [],
  "parameters": [],
  "entry": {
    "requires": [
      "source physical state and score window",
      "pinned controller and memory revisions"
    ],
    "validated_windows": []
  },
  "exit": {
    "preserves": [
      "full integration state",
      "acoustic history"
    ],
    "requires_recovery_validation": true
  },
  "memory": {
    "reads": [
      "experiences",
      "diagnostics",
      "progress"
    ],
    "writes": "candidate evidence through harness; no implicit active-state mutation"
  },
  "qualification": {
    "cross_piece_transfer_validated": false,
    "evidence_refs": [],
    "limitations": [
      "结构占位；没有独立实现或资格证据。"
    ]
  },
  "composition": {
    "mode": "serial",
    "parallel_live_piano_writers_allowed": false
  },
  "preview": null
}
