{
  "schema": "piano.skill.structure/v1",
  "id": "neighbor-clearance",
  "revision": "structure-v1",
  "name": "邻键避碰与错音筛选",
  "category": "coordination",
  "status": "experimental",
  "purpose": "结合碰撞 IK 与短时仿真淘汰会产生额外起音的候选动作。",
  "input_contract": "piano.practice_context/v1",
  "output_contract": "piano.practice_context/v1",
  "required_inputs": [
    "native_contacts",
    "target_key_set",
    "acoustic_history_ref"
  ],
  "effects": [
    "simulation.hand_proposal"
  ],
  "dependencies": [
    {
      "id": "hand-assignment",
      "revision": "structure-v1"
    },
    {
      "id": "idle-retraction",
      "revision": "structure-v1"
    }
  ],
  "implementation_refs": [
    "robopianist/rsi/collision_ik.py",
    "robopianist/rsi/ensemble_controller.py"
  ],
  "parameters": [
    "collision_refinement_weight",
    "ensemble_avoid_transient_strikes"
  ],
  "entry": {
    "requires": [
      "source physical state and score window",
      "pinned controller and memory revisions"
    ],
    "validated_windows": []
  },
  "exit": {
    "preserves": [
      "full integration state",
      "acoustic history"
    ],
    "requires_recovery_validation": true
  },
  "memory": {
    "reads": [
      "experiences",
      "diagnostics",
      "progress"
    ],
    "writes": "candidate evidence through harness; no implicit active-state mutation"
  },
  "qualification": {
    "cross_piece_transfer_validated": false,
    "evidence_refs": [
      {
        "path": "artifacts/contact-consistency/continual-force4-20261004/skills/06b58050e9f1f1bea4e178a7a6fe570ff79191a6fa2c40d4ce4bba6615ed8e9f.json",
        "revision": "06b58050e9f1f1bea4e178a7a6fe570ff79191a6fa2c40d4ce4bba6615ed8e9f",
        "scope": "Experimental source card."
      }
    ],
    "limitations": [
      "错音减少可能伴随漏音；尚未通过完整保留正确音的资格要求。"
    ]
  },
  "composition": {
    "mode": "serial",
    "parallel_live_piano_writers_allowed": false
  },
  "preview": null
}
