{
  "schema": "piano.skill.structure/v1",
  "id": "dynamic-phrasing",
  "revision": "structure-v1",
  "name": "强弱与乐句塑形",
  "category": "musicality",
  "status": "planned",
  "purpose": "沿乐句控制实际起音力度和时间变化。",
  "input_contract": "piano.practice_context/v1",
  "output_contract": "piano.practice_context/v1",
  "required_inputs": [
    "phrase_boundaries",
    "dynamic_curve"
  ],
  "effects": [
    "simulation.hand_proposal"
  ],
  "dependencies": [
    {
      "id": "voice-balance",
      "revision": "structure-v1"
    },
    {
      "id": "legato-transition",
      "revision": "structure-v1"
    }
  ],
  "implementation_refs": [],
  "parameters": [],
  "entry": {
    "requires": [
      "source physical state and score window",
      "pinned controller and memory revisions"
    ],
    "validated_windows": []
  },
  "exit": {
    "preserves": [
      "full integration state",
      "acoustic history"
    ],
    "requires_recovery_validation": true
  },
  "memory": {
    "reads": [
      "experiences",
      "diagnostics",
      "progress"
    ],
    "writes": "candidate evidence through harness; no implicit active-state mutation"
  },
  "qualification": {
    "cross_piece_transfer_validated": false,
    "evidence_refs": [],
    "limitations": [
      "已有力度评估不等于已学会力度控制。"
    ]
  },
  "composition": {
    "mode": "serial",
    "parallel_live_piano_writers_allowed": false
  },
  "preview": null
}
