{
  "schema": "piano.skill.structure/v1",
  "id": "voice-balance",
  "revision": "structure-v1",
  "name": "声部平衡与旋律突出",
  "category": "musicality",
  "status": "planned",
  "purpose": "依据声部标注控制旋律和伴奏的力度关系。",
  "input_contract": "piano.practice_context/v1",
  "output_contract": "piano.practice_context/v1",
  "required_inputs": [
    "voice_annotations",
    "per_voice_velocity_targets"
  ],
  "effects": [
    "simulation.hand_proposal"
  ],
  "dependencies": [
    {
      "id": "key-contact",
      "revision": "structure-v1"
    }
  ],
  "implementation_refs": [],
  "parameters": [],
  "entry": {
    "requires": [
      "source physical state and score window",
      "pinned controller and memory revisions"
    ],
    "validated_windows": []
  },
  "exit": {
    "preserves": [
      "full integration state",
      "acoustic history"
    ],
    "requires_recovery_validation": true
  },
  "memory": {
    "reads": [
      "experiences",
      "diagnostics",
      "progress"
    ],
    "writes": "candidate evidence through harness; no implicit active-state mutation"
  },
  "qualification": {
    "cross_piece_transfer_validated": false,
    "evidence_refs": [],
    "limitations": [
      "最高音不能自动视为旋律；尚未验证声部表现。"
    ]
  },
  "composition": {
    "mode": "serial",
    "parallel_live_piano_writers_allowed": false
  },
  "preview": null
}
