{
  "schema": "piano.skill.structure/v1",
  "id": "key-contact",
  "revision": "structure-v1",
  "name": "单键触键与释放",
  "category": "primitives",
  "status": "existing_component",
  "purpose": "根据目标键计算触键姿态并搜索按压参数。",
  "input_contract": "piano.practice_context/v1",
  "output_contract": "piano.practice_context/v1",
  "required_inputs": [
    "key_geometry",
    "assigned_finger",
    "target_onset",
    "target_offset"
  ],
  "effects": [
    "simulation.hand_proposal"
  ],
  "dependencies": [],
  "implementation_refs": [
    "robopianist/rsi/hand_controller.py"
  ],
  "parameters": [
    "press_force",
    "reach_z",
    "key_offsets"
  ],
  "entry": {
    "requires": [
      "source physical state and score window",
      "pinned controller and memory revisions"
    ],
    "validated_windows": []
  },
  "exit": {
    "preserves": [
      "full integration state",
      "acoustic history"
    ],
    "requires_recovery_validation": true
  },
  "memory": {
    "reads": [
      "experiences",
      "diagnostics",
      "progress"
    ],
    "writes": "candidate evidence through harness; no implicit active-state mutation"
  },
  "qualification": {
    "cross_piece_transfer_validated": false,
    "evidence_refs": [],
    "limitations": [
      "尚未认证为可独立跨曲复用的单键策略。"
    ]
  },
  "composition": {
    "mode": "serial",
    "parallel_live_piano_writers_allowed": false
  },
  "preview": null
}
