{
  "schema": "piano.skill.structure/v1",
  "id": "small-motion-selection",
  "revision": "structure-v1",
  "name": "小位移手型选择",
  "category": "coordination",
  "status": "experimental",
  "purpose": "在候选动作筛选中偏好较小手腕位移。",
  "input_contract": "piano.practice_context/v1",
  "output_contract": "piano.practice_context/v1",
  "required_inputs": [
    "previous_pose",
    "candidate_poses"
  ],
  "effects": [
    "simulation.hand_proposal"
  ],
  "dependencies": [
    {
      "id": "hand-assignment",
      "revision": "structure-v1"
    }
  ],
  "implementation_refs": [
    "robopianist/rsi/ensemble_controller.py"
  ],
  "parameters": [
    "ensemble_prefer_small_motion",
    "ensemble_small_motion_threshold"
  ],
  "entry": {
    "requires": [
      "source physical state and score window",
      "pinned controller and memory revisions"
    ],
    "validated_windows": [
      {
        "piece": "october",
        "start_frame": 1920,
        "end_frame": 2000,
        "recovery_end_frame": 2040,
        "scope": "local experiment only"
      }
    ]
  },
  "exit": {
    "preserves": [
      "full integration state",
      "acoustic history"
    ],
    "requires_recovery_validation": true
  },
  "memory": {
    "reads": [
      "experiences",
      "diagnostics",
      "progress"
    ],
    "writes": "candidate evidence through harness; no implicit active-state mutation"
  },
  "qualification": {
    "cross_piece_transfer_validated": false,
    "evidence_refs": [
      {
        "path": "artifacts/contact-consistency/continual-force4-20261004/skills/99a683c60d18d7318763b729d9fd897378368afe4ae9b26d83978b70dbb8aa26.json",
        "revision": "99a683c60d18d7318763b729d9fd897378368afe4ae9b26d83978b70dbb8aa26",
        "scope": "Unqualified contextual candidate."
      }
    ],
    "limitations": [
      "已有局部改善；其他窗口迁移并非都成功。"
    ]
  },
  "composition": {
    "mode": "serial",
    "parallel_live_piano_writers_allowed": false
  },
  "preview": null
}
