{
  "schema": "piano.skill.structure/v1",
  "id": "hand-assignment",
  "revision": "structure-v1",
  "name": "双手与手指分配",
  "category": "coordination",
  "status": "existing_component",
  "purpose": "按键位置和手跨度分配双手及手指。",
  "input_contract": "piano.practice_context/v1",
  "output_contract": "piano.practice_context/v1",
  "required_inputs": [
    "target_key_set",
    "previous_assignment"
  ],
  "effects": [
    "simulation.hand_proposal"
  ],
  "dependencies": [
    {
      "id": "key-contact",
      "revision": "structure-v1"
    }
  ],
  "implementation_refs": [
    "robopianist/rsi/hand_controller.py"
  ],
  "parameters": [
    "ordered_hand_assignment",
    "adaptive_hand_assignment",
    "hand_span_penalty"
  ],
  "entry": {
    "requires": [
      "source physical state and score window",
      "pinned controller and memory revisions"
    ],
    "validated_windows": []
  },
  "exit": {
    "preserves": [
      "full integration state",
      "acoustic history"
    ],
    "requires_recovery_validation": true
  },
  "memory": {
    "reads": [
      "experiences",
      "diagnostics",
      "progress"
    ],
    "writes": "candidate evidence through harness; no implicit active-state mutation"
  },
  "qualification": {
    "cross_piece_transfer_validated": false,
    "evidence_refs": [
      {
        "path": "artifacts/contact-consistency/continual-force4-20261004/skills/2f834ad4a6a41cef857bcc29d9c421386fd886256867cc093bfc44ab14d70914.json",
        "revision": "2f834ad4a6a41cef857bcc29d9c421386fd886256867cc093bfc44ab14d70914",
        "scope": "Existing legacy qualification is limited to kinematic-hand passive-piano diagnostic; no cross-piece transfer qualification."
      }
    ],
    "limitations": [
      "已有全曲控制器证据；不等于所有指法都已验证。"
    ]
  },
  "composition": {
    "mode": "serial",
    "parallel_live_piano_writers_allowed": false
  },
  "preview": null
}
