{
  "schema": "piano.skill.structure/v1",
  "id": "lateral-contact-repair",
  "revision": "structure-v1",
  "name": "局部触键位置修复",
  "category": "contextual_repairs",
  "status": "experimental",
  "purpose": "从误触接触证据生成毫米级目标触点偏移。",
  "input_contract": "piano.practice_context/v1",
  "output_contract": "piano.practice_context/v1",
  "required_inputs": [
    "misstrike_contact_evidence",
    "source_checkpoint",
    "target_key"
  ],
  "effects": [
    "simulation.hand_proposal"
  ],
  "dependencies": [
    {
      "id": "neighbor-clearance",
      "revision": "structure-v1"
    }
  ],
  "implementation_refs": [
    "examples/propose_piano_clearance_repairs.py"
  ],
  "parameters": [
    "key_y_offsets"
  ],
  "entry": {
    "requires": [
      "source physical state and score window",
      "pinned controller and memory revisions"
    ],
    "validated_windows": [
      {
        "piece": "october",
        "start_frame": 2600,
        "end_frame": 2610,
        "recovery_end_frame": 2650,
        "scope": "local experiment only"
      }
    ]
  },
  "exit": {
    "preserves": [
      "full integration state",
      "acoustic history"
    ],
    "requires_recovery_validation": true
  },
  "memory": {
    "reads": [
      "experiences",
      "diagnostics",
      "progress"
    ],
    "writes": "candidate evidence through harness; no implicit active-state mutation"
  },
  "qualification": {
    "cross_piece_transfer_validated": false,
    "evidence_refs": [
      {
        "path": "artifacts/contact-consistency/continual-force4-20261004/skills/80d8e5e1dacda6098b966ae34a8c36bc9cee5ff7125215e029898dc58d9be5fb.json",
        "revision": "80d8e5e1dacda6098b966ae34a8c36bc9cee5ff7125215e029898dc58d9be5fb",
        "scope": "Unqualified contextual candidate."
      }
    ],
    "limitations": [
      "key 34 的 +3 mm 修复只在特定入口有证据，不能直接推广。"
    ]
  },
  "composition": {
    "mode": "serial",
    "parallel_live_piano_writers_allowed": false
  },
  "preview": null
}
